{
  "$schema": "https://json-schema.org/draft/2020-12/schema",
  "$id": "https://mybench.dev/schemas/v1/report.schema.json",
  "title": "Mybench Report",
  "description": "Versioned activity report derived from ledger metadata per docs/metrics-v0.md. This is a publishable-field whitelist (privacy invariant #1): aggregates and coarse bucketed distributions only — no per-session values, no time series, no hour-of-day granularity, no ordered sequences. Version 1 replaces the v0 stub; every metric carries exactly one trust tier (THREAT_MODEL §6). The tier enum is extended only by schema_version bump (future TEE-VERIFIED).",
  "type": "object",
  "additionalProperties": false,
  "required": ["schema_version", "report_version", "generated_at", "scorer_version", "metrics"],
  "properties": {
    "schema_version": {
      "description": "Report schema version; bump on breaking changes (including tier-enum or bucket-edge changes).",
      "const": "1"
    },
    "report_version": {
      "description": "Version label of this particular report instance.",
      "type": "string",
      "minLength": 1
    },
    "generated_at": {
      "description": "UTC RFC 3339 timestamp, supplied as scorer INPUT (determinism).",
      "type": "string",
      "pattern": "^\\d{4}-\\d{2}-\\d{2}T\\d{2}:\\d{2}:\\d{2}(\\.\\d+)?Z$"
    },
    "scorer_version": {
      "description": "Version of the scorer that produced this report.",
      "type": "string",
      "minLength": 1
    },
    "input_schema_versions": {
      "description": "Schema versions observed in the private ledger rows and date-only anchor events used by the scorer.",
      "type": "object",
      "additionalProperties": false,
      "required": ["ledger", "anchor"],
      "properties": {
        "ledger": {
          "type": "array",
          "uniqueItems": true,
          "items": {"type": "string", "minLength": 1}
        },
        "anchor": {
          "type": "array",
          "uniqueItems": true,
          "items": {"type": "string", "minLength": 1}
        }
      }
    },
    "anchored_through": {
      "description": "Latest UTC date among supplied anchor events; absent when no anchor exists.",
      "type": "string",
      "format": "date",
      "pattern": "^\\d{4}-\\d{2}-\\d{2}$"
    },
    "backfill_note": {
      "description": "Required whenever capture-time-based metrics are present: states that backfilled history is anchored as of anchor time.",
      "type": "string",
      "minLength": 1
    },
    "binding_tips": {
      "description": "Pinned repo tips used for binding_coverage, keyed by opted-in repo name: full commit hash.",
      "type": "object",
      "additionalProperties": false,
      "patternProperties": {
        "^[A-Za-z0-9._/-]{1,200}$": {
          "type": "string",
          "pattern": "^([0-9a-f]{40}|[0-9a-f]{64})$"
        }
      }
    },
    "metrics": {
      "description": "Computed metrics per docs/metrics-v0.md, sorted by name.",
      "type": "array",
      "minItems": 1,
      "items": {
        "type": "object",
        "additionalProperties": false,
        "required": ["name", "value", "trust_tier"],
        "properties": {
          "name": {
            "description": "Metric name as pinned in docs/metrics-v0.md.",
            "type": "string",
            "pattern": "^[a-z][a-z0-9_]{1,63}$"
          },
          "value": {
            "description": "Aggregate number, or a distribution keyed by pinned bucket labels.",
            "oneOf": [
              {"type": "number"},
              {"type": "boolean"},
              {
                "type": "object",
                "additionalProperties": false,
                "patternProperties": {
                  "^[A-Za-z0-9._+/ -]{1,64}$": {"type": "number"}
                }
              }
            ]
          },
          "trust_tier": {
            "description": "PROVEN = verifiable from public artifacts + open code alone; ANCHORED = timing/volume proven, content-derived facts asserted; JUDGED = reproducible model opinion (excluded in v0).",
            "type": "string",
            "enum": ["PROVEN", "ANCHORED", "JUDGED"]
          },
          "caveat": {
            "description": "Honest-limits note that ships WITH the metric (e.g. provider-reported token counts).",
            "type": "string",
            "minLength": 1
          }
        }
      }
    }
  }
}
