{"anchored_through":"2026-02-02","backfill_note":"Imported history includes only records locally available at import time and is not a completeness claim. Imported rows are anchored as of anchor time; capture-time metrics (ledger_span_days, active_days, sessions_total) reflect when rows were appended, not when the underlying work happened.","binding_tips":{"synthetic/repo":"bbbbbbbbbbbbbbbbbbbbbbbbbbbbbbbbbbbbbbbb"},"generated_at":"2026-07-09T00:00:00Z","input_schema_versions":{"anchor":["2"],"ledger":["1","2"]},"metrics":[{"name":"active_days","trust_tier":"ANCHORED","value":4},{"name":"anchor_chain_continuity","trust_tier":"PROVEN","value":true},{"caveat":"Local wall-clock time after the first successful OTS calendar response; self-attested, not the independently verified Bitcoin block time.","name":"anchor_latency_distribution","trust_tier":"ANCHORED","value":{"00_under_5m":0,"01_5m_to_1h":2,"02_1h_to_24h":0,"03_1d_to_7d":3,"04_7d_plus":2,"05_unknown":0}},{"name":"anchored_capture_events","trust_tier":"PROVEN","value":4},{"name":"anchored_span_days","trust_tier":"PROVEN","value":31},{"name":"binding_coverage","trust_tier":"PROVEN","value":{"synthetic/repo":0.5}},{"caveat":"Percentages cover only ledger rows named by supplied anchor events. Explicit row provenance is used at and after the v3 boundary; frozen earlier rows retain the legacy first-anchor classification. Unanchored local rows are excluded.","name":"evidence_provenance_split","trust_tier":"PROVEN","value":{"IMPORTED":0.4286,"LIVE":0.5714}},{"name":"items_total","trust_tier":"ANCHORED","value":1552},{"name":"ledger_span_days","trust_tier":"ANCHORED","value":32},{"name":"session_size_distribution","trust_tier":"ANCHORED","value":{"0001-0010":0,"0011-0100":2,"0101-1000":0,"1001+":1}},{"name":"sessions_per_week_distribution","trust_tier":"ANCHORED","value":{"00":4,"01-05":2,"06-15":0,"16-40":0,"41+":0}},{"name":"sessions_total","trust_tier":"ANCHORED","value":3},{"name":"source_breakdown","trust_tier":"ANCHORED","value":{"synthetic":3}}],"report_version":"v0","schema_version":"1","scorer_version":"0.3.0"}
